Title,Authors,Published Year,Journal,Volume,Issue,Pages,DOI
Use of Computer-Based Interventions to Teach Communication Skills to Children with Autism Spectrum Disorders: A Systematic Review,"Ramdoss, Sathiyaprakash sathiya ramdoss mail utexas edu; Lang, Russell; Mulloy, Austin; Franco, Jessica; O'Reilly, Mark; Didden, Robert; Lancioni, Giulio",2011,Journal of Behavioral Education,20,1,55-76,10.1007/s10864-010-9112-7
Learning With Computer-Based Learning Environments: A Literature Review of Computer Self-Efficacy,"Moos, D. C.; Azevedo, R.",2009,Review of Educational Research,79,2,576-600,
Gaming for Earth: Serious games and gamification to engage consumers in pro-environmental behaviours for energy efficiency,"Morganti, L.; Pallavicini, F.; Cadel, E.; Candelieri, A.; Archetti, F.; Mantovani, F.",2017,Energy Research & Social Science,29,,95-102,
Interventions to Prevent and Reduce Cyber Abuse of Youth: A Systematic Review,"Mishna, Faye; Cook, Charlene; Saini, Michael; Wu, Meng-Jia; MacFadden, Robert",2011,Research on Social Work Practice,21,1,May-14,10.1177/1049731509351988
Who's calling for weight loss? A systematic review of mobile phone weight loss programs for adolescents,"Wickham, C. A.; Carbone, E. T.",2015,Nutrition Reviews,73,6,386-398,
Evidence-based guidelines for wise use of electronic games by children,"Straker, L.; Abbott, R.; Collins, R.; Campbell, A.",2014,Ergonomics,57,4,471-489,
Sedentary behavior and indicators of mental health in school-aged children and adolescents: A systematic review,"Suchert, V.; Hanewinkel, R.; Isensee, B.",2015,Preventive Medicine,76,,48-57,
New technologies in early childhood literacy research: A review of research,"Lankshear, Colin; Knobel, Michele",2003,Journal of Early Childhood Literacy,3,1,59-82,10.1177/14687984030031003
Headsprout: A Systematic Review of the Evidence,"Rigney, Alexander M.; Hixson, Michael D.; Drevon, Daniel D.",2020,Journal of Behavioral Education,29,1,153-167,http://dx.doi.org/10.1007/s10864-019-09345-6
"Screen time, dietary patterns and intake of potentially cariogenic food in children: A systematic review","Shqair, Ayah Qassem; Pauli, Laís Anschau; Costa, Vanessa Polina Pereira; Cenci, Maximiliano; Goettems, Marília Leão",2019,Journal of dentistry,86,,17-26,10.1016/j.jdent.2019.06.004
The association between sedentary behaviour and risk of anxiety: a systematic review,"Teychenne, M.; Costigan, S. A.; Parker, K.",2015,BMC public health,15,,513,
A systematic review for the effects of television viewing by infants and preschoolers,"Thakkar, R. R.; Garrison, M. M.; Christakis, D. A.",2006,Pediatrics,118,5,2025-2031,
Mobile phone messaging for preventive health care,"Vodopivec-Jamsek, V.; de Jongh, T.; Gurol-Urganci, I.; Atun, R.; Car, J.",2012,Cochrane database of systematic reviews (Online),12,,CD007457,
Correlates of Sedentary Behavior in Children and Adolescents Aged 7-18: A Systematic Review,"Temmel, C. P.; Rhodes, R. E.",2013,Annals of Behavioral Medicine,45,,S287-S287,
Use of theory in computer-based interventions to reduce alcohol use among adolescents and young adults: a systematic review,"Tebb, K. P.; Erenrich, R. K.; Jasik, C. B.; Berna, M. S.; Lester, J. C.; Ozer, E. M.",2016,BMC public health,16,,517,
Mobile Phone Addiction Among Children and Adolescents: A Systematic Review,"Sahu, Maya; Gandhi, Sailaxmi; Sharma, Manoj Kumar",2019,Journal of Addictions Nursing (Lippincott Williams & Wilkins),30,4,261-268,10.1097/JAN.0000000000000309
Comprehensive Review on Academic Achievement Levels through M-Learning,"Lakhan, Anjay; Kumar, Laxman",2019,i-Manager's Journal on Educational Psychology,13,2,49-58,http://dx.doi.org/10.26634/jpsy.13.2.15535
The Factors Determining the Physical Activity of Students: A Systematic Review,"Ramezankhani, A.; Alipour-Anbarani, M.; Saeidi, M.",2019,International Journal of Pediatrics-Mashhad,7,8,9977-9985,10.22038/ijp.2019.41932.3533
Correlates of physical activity and sedentary behaviour in the Thai population: a systematic review,"Liangruenrom, Nucharapon; Craike, Melinda; Biddle, Stuart J. H.; Suttikasem, Kanyapat; Pedisic, Zeljko",2019,BMC Public Health,19,1,N.PAG-N.PAG,10.1186/s12889-019-6708-2
Effects of Active Videogames on Physical Activity and Related Outcomes Among Healthy Children: A Systematic Review,"Liang, Y.; Lau, P. W. C.",2014,Games for Health Journal,3,3,122-+,
"The clustering of diet, physical activity and sedentary behavior in children and adolescents: a review","Leech, Rebecca M.; McNaughton, Sarah A.; Timperio, Anna",2014,The International Journal Of Behavioral Nutrition And Physical Activity,11,,4-Apr,10.1186/1479-5868-11-4
"Review of Childhood Obesity: From Epidemiology, Etiology, and Comorbidities to Clinical Assessment and Treatment","Kumar, Seema; Kelly, Aaron S.",2017,Mayo Clinic Proceedings,92,2,251-265,10.1016/j.mayocp.2016.09.017
"A systematic review of the relationship between internet use, self-harm and suicidal behaviour in young people: The good, the bad and the unknown","Marchant, Amanda; Hawton, Keith; Stewart, Ann; Montgomery, Paul; Singaravelu, Vinod; Lloyd, Keith; Purdy, Nicola; Daine, Kate; John, Ann",2017,PLoS ONE,12,8,,
A Review of Technology-Based Youth and Family-Focused Interventions,"MacDonell, Kathleen Watson; Prinz, Ronald J.",2017,Clinical Child And Family Psychology Review,20,2,185-200,10.1007/s10567-016-0218-x
Chances and Limitations of Video Games in the Fight against Childhood Obesity-A Systematic Review,"Mack, Isabelle; Bayer, Carolin; Schäffeler, Norbert; Reiband, Nadine; Brölz, Ellen; Zurstiege, Guido; Fernandez-Aranda, Fernando; Gawrilow, Caterina; Zipfel, Stephan",2017,European Eating Disorders Review: The Journal Of The Eating Disorders Association,25,4,237-267,10.1002/erv.2514
Interventions to prevent or treat obesity in preschool children: A review of evaluated programs,"Bluford, D. A. A.; Sherry, B.; Scanlon, K. S.",2007,Obesity,15,6,1356-1372,
Digital literacy practices among youth populations: A review of the literature,"Blummer, Barbara",2008,Education Libraries,31,1,38-45,
Psychological interventions in the treatment of childhood obesity: what we know and need to find out,"Bogle, V.; Sykes, C.",2011,Journal of health psychology,16,7,997-1014,
Effects of mobile health including wearable activity trackers to increase physical activity outcomes among healthy children and adolescents: Systematic review,"Böhm, B.; Karwiese, S. D.; Böhm, H.; Oberhoffer, R.",2019,Journal of Medical Internet Research,21,4,,10.2196/mhealth.8298
Measuring and Influencing Physical Activity with Smartphone Technology: A Systematic Review,"Bort-Roig, J.; Gilson, N. D.; Puig-Ribera, A.; Contreras, R. S.; Trost, S. G.",2014,Sports Medicine,44,5,671-686,
Cyberbullying and adolescent mental health: systematic review,"Bottino, S. M.; Bottino, C. M.; Regina, C. G.; Correia, A. V.; Ribeiro, W. S.",2015,Cadernos de saude publica,31,3,463-475,
Adolescents and self-taken sexual images: A review of the literature,"Cooper, K.; Quayle, E.; Jonsson, L.; Svedin, C. G.",2016,Computers in Human Behavior,55,,706-716,
The health indicators associated with screen-based sedentary behavior among adolescent girls: A systematic review,"Costigan, S. A.; Barnett, L.; Plotnikoff, R. C.; Lubans, D. R.",2013,Journal of Adolescent Health,52,4,382-392,
Spanish-Language Consumer Health Information Technology Interventions: A Systematic Review,"Chaet, Alexis V.; Morshedi, Bijan; Wells, Kristen J.; Barnes, Laura E.; Valdez, Rupa",2016,Journal Of Medical Internet Research,18,8,e214-e214,10.2196/jmir.5794
Using mobile technology to promote safe sex and sexual health in adolescents: Current practices and future recommendations,"Cornelius, J. B.; Appiah, J. A.",2016,"Adolescent Health, Medicine and Therapeutics",7,,43-57,
Correlates of energy balance-related behaviours in preschool children: A systematic review,"De Craemer, M.; De Decker, E.; De Bourdeaudhuij, I.; Vereecken, C.; Deforche, B.; Manios, Y.; Cardon, G.",2012,Obesity Reviews,13,SUPPL. 1,13-28,
The Potentials of Using Cloud Computing in Schools: A Systematic Literature Review,"Hartmann, Simon Birk; Braae, Lotte Qulleq Nygaard; Pedersen, Sine; Khalid, Saifuddin Md",2017,Turkish Online Journal of Educational Technology - TOJET,16,1,190-202,
Prevalence and factors associated with low aerobic performance levels in adolescents: A systematic review,"de Andrade Goncalves, E. C.; Silva, D. A. S.; Nunes, H. E. G.",2015,Current Pediatric Reviews,11,1,56-70,
Podcast Applications in Language Learning: A Review of Recent Studies,"Hasan, Masudul Md; Hoon, Tan Bee",2013,English Language Teaching,6,2,128-135,
Do interventions to limit sedentary behaviours change behaviour and reduce childhood obesity? A critical review of the literature,"DeMattia, L.; Lemont, L.; Meurer, L.",2007,Obesity Reviews,8,1,69-81,
Obesogenic behaviours and depressive symptoms in children: a narrative literature review,"Dennison, M.; Sisson, S. B.; Morris, A.",2016,Obesity Reviews,17,8,735-757,
Benefits and Factors Influencing the Design of Intergenerational Digital Games: A Systematic Literature Review,"de la Hera, T.; Loos, E.; Simons, M.; Blom, J.",2017,Societies,7,3,15,10.3390/soc7030018
Web-based interventions for youth internalizing problems: a systematic review (Provisional abstract),"Reyes-Portillo, J. A.; Mufson, L.; Greenhill, L. L.; Gould, M. S.; Fisher, P. W.; Tarlow, N.; Rynn, M. A.",2014,Database of Abstracts of Reviews of Effects,,2,1254-1270.e5,
Web-based interventions for youth internalizing problems: A systematic review,"Reyes-Portillo, Jazmin A.; Mufson, Laura; Greenhill, Laurence L.; Gould, Madelyn S.; Fisher, Prudence W.; Tarlow, Naomi; Rynn, Moira A.",2014,Journal of the American Academy of Child & Adolescent Psychiatry,53,12,1254-1270,10.1016/j.jaac.2014.09.005
What are the determinants of children's sleep behavior? A systematic review of longitudinal studies,"Belmon, Laura S.; van Stralen, Maartje M.; Busch, Vincent; Harmsen, Irene A.; Chinapaw, Mai J. M.",2019,Sleep medicine reviews,43,,60-70,10.1016/j.smrv.2018.09.007
The Implications of Screen Media Use for the Sleep Behavior of Children Ages 0-5: a Systematic Review of the Literature,"Moorman, J. D.; Morgan, P.; Adams, T. L.",2019,Current Sleep Medicine Reports,5,3,164-172,http://dx.doi.org/10.1007/s40675-019-00151-0
Diet and Nutrition; Studies from Columbia University Further Understanding of Diet and Nutrition (The use of social media in nutrition interventions for adolescents and young adults-A systematic review),,2018,Health & Medicine Week,,,647,
Anti-bullying programs and Information and Communication Technologies (ICTs): A systematic review,"Nocentini, A.; Zambuto, V.; Menesini, E.",2015,Aggression and Violent Behavior,23,,52-60,10.1016/j.avb.2015.05.012
Cybervictimization of Young People With an Intellectual or Developmental Disability: Risks Specific to Sexual Solicitation,"Normand, C. L.; Sallafranque-St-Louis, F.",2016,J Appl Res Intellect Disabil,29,2,99-110,10.1111/jar.12163
Active video games in schools and effects on physical activity and health: A systematic review,"Norris, E.; Hamer, M.; Stamatakis, E.",2016,Journal of Pediatrics,172,,40-46e5,
A 10-year systematic review of HIV/AIDS mass communication campaigns: have we made progress?,"Noar, Seth M; Palmgreen, Philip; Chabot, Melissa; Dobransky, Nicole; Zimmerman, Rick S",2009,Journal of health communication,14,1,15-42,
Comparative effects of computer-assisted instruction: A synthesis of reviews,"Niemiec, Richard; Walberg, Herbert J.",1987,Journal of Educational Computing Research,3,1,19-37,
Technology Mediated Self-Prompting of Daily Living Skills for Adolescents and Adults with Disabilities: A Review of the Literature,"Cullen, J. M.; Alber-Morgan, S. R.",2015,Education and Training in Autism and Developmental Disabilities,50,1,43-55,
Text Messaging Interventions for Improvement in Physical Activity and Sedentary Behavior in Youth: Systematic Review,"Ludwig, Kim; Arthur, Rosie; Sculthorpe, Nicholas; Fountain, Hollie; Buchan, Duncan S.",2018,Journal of Medical Internet Research,20,9,105-105,10.2196/10799
The use of digital technology to improve and monitor handwashing among children 12 years or younger in educational settings: a systematic review,"Ofori, S. K.; Hung, Y. W.; Muniz-Rodriguez, K.; Kakau, R. J.; Alade, S. E.; Diallo, K.; Sullivan, K. L.; Schwind, J. S.; Cowling, B. J.; Fung, I. C. H.",2019,American Journal of Tropical Medicine and Hygiene,101,5 Supplement,185,http://dx.doi.org/10.4269/ajtmh.abstract2019
Can exergaming contribute to improving physical activity levels and health outcomes in children?,"Daley, A. J.",2009,Pediatrics,124,2,763-771,10.1542/peds.2008-2357
Interventions to reduce inequalities in vaccine uptake in children and adolescents aged <19 years: a systematic review,"Crocker-Buque, Tim; Edelstein, Michael; Mounier-Jack, Sandra",2017,Journal Of Epidemiology And Community Health,71,1,87-97,10.1136/jech-2016-207572
Social media use and depression in adolescents: a scoping review,"Vidal, Carol; Lhaksampa, Tenzin; Miller, Leslie; Platt, Rheanna",2020,International Review of Psychiatry,32,3,235-253,10.1080/09540261.2020.1720623
Anti-bullying interventions in schools: a systematic literature review,"da Silva, J. L.; de Oliveira, W. A.; de Mello, F. C. M.; de Andrade, L. S.; Bazon, M. R.; Silva, M. A. I.",2017,Ciencia & Saude Coletiva,22,7,2329-2340,
"Combinations of physical activity, sedentary behaviour and sleep: relationships with health indicators in school-aged children and youth","Saunders, T. J.; Gray, C. E.; Poitras, V. J.; Chaput, J. P.; Janssen, I.; Katzmarzyk, P. T.; Olds, T.; Connor Gorber, S.; Kho, M. E.; Sampson, M.; Tremblay, M. S.; Carson, V.",2016,"Applied physiology, nutrition, and metabolism = Physiologie appliquee, nutrition et metabolisme",41,6 Supplement 3,S283-S293,
The potential of technology-based psychological interventions for anorexia and bulimia nervosa: a systematic review and recommendations for future research,"Schlegl, S.; Burger, C.; Schmidt, L.; Herbst, N.; Voderholzer, U.",2015,Journal of medical Internet research,17,3,e85,
Just-in-Time Feedback in Diet and Physical Activity Interventions: Systematic Review and Practical Design Framework,"Schembre, S. M.; Liao, Y.; Robertson, M. C.; Dunton, G. F.; Kerr, J.; Haffey, M. E.; Burnett, T.; Basen-Engquist, K.; Hicklen, R. S.",2018,Journal of Medical Internet Research,20,3,14,10.2196/jmir.8701
"Efficacy of interventions that use apps to improve diet, physical activity and sedentary behaviour: a systematic review","Schoeppe, Stephanie; Alley, Stephanie; Van Lippevelde, Wendy; Bray, Nicola A.; Williams, Susan L.; Duncan, Mitch J.; Vandelanotte, Corneel",2016,The International Journal Of Behavioral Nutrition And Physical Activity,13,1,127-127,
Does viewing violent media really cause criminal violence? A methodological review,"Savage, J.",2004,Aggression and Violent Behavior,10,1,99-128,
Predictors and Social Consequences of Online Interactive Self-Disclosure: A Literature Review from 2002 to 2014,"Desjarlais, M.; Gilmour, J.; Sinclair, J.; Howell, K. B.; West, A.",2015,"Cyberpsychology, behavior and social networking",18,12,718-725,
Effective intervention or child's play? A review of video games for diabetes education,"DeShazo, Jonathan; Harris, Lynne; Pratt, Wanda",2010,Diabetes Technology & Therapeutics,12,10,815-822,10.1089/dia.2010.0030
Use of Technology for HIV Prevention Among Adolescent and Adult Women in the United States,"Blackstock, Oni J.; Patel, Viraj V.; Cunningham, Chinazo O.",2015,Current HIV/AIDS Reports,12,4,489-499,10.1007/s11904-015-0287-3
Determinants of fruit and vegetable consumption among 6-12-year-old children and effective interventions to increase consumption,"Blanchette, L.; Brug, J.",2005,Journal of Human Nutrition and Dietetics,18,6,431-443,
Assessing the Internal and External Validity of Mobile Health Physical Activity Promotion Interventions: A Systematic Literature Review Using the RE-AIM Framework,"Blackman, K. C. A.; Zoellner, J.; Berrey, L. M.; Alexander, R.; Fanning, J.; Hill, J. L.; Estabrooks, P. A.",2013,Journal of Medical Internet Research,15,10,81-95,
Role of video games in improving health-related outcomes: A systematic review,"Primack, B. A.; Carroll, M. V.; McNamara, M.; Klem, M. L.; King, B.; Rich, M.; Chan, C. W.; Nayak, S.",2012,American Journal of Preventive Medicine,42,6,630-638,
Primary Care Behavioral Interventions to Prevent or Reduce Illicit Drug and Nonmedical Pharmaceutical Use in Children and Adolescents: A Systematic Evidence Review for the U.S. Preventive Services Task Force,"Patnode, Carrie D.; O'Connor, Elizabeth; Rowland, Maya; Burda, Brittany U.; Perdue, Leslie A.; Whitlock, Evelyn P.",2014,,,,,
Using active video games for physical activity promotion: a systematic review of the current state of research,"Peng, Wei; Crouse, Julia C.; Lin, Jih-Hsuan",2013,Health Education & Behavior: The Official Publication Of The Society For Public Health Education,40,2,171-192,10.1177/1090198112444956
Videogame-Related Illness and Injury: A Review of the Literature and Predictions for Pokemon GO!,"Pourmand, A.; Lombardi, K.; Kuhl, E.; O'Connell, F.",2017,Games for Health Journal,6,1,Sep-18,
Tablet-Based eBooks for Young Children: What Does the Research Say?,"Reich, S. M.; Yau, J. C.; Warschauer, M.",2016,Journal of Developmental and Behavioral Pediatrics,37,7,585-591,
A Comparison of Family Interventions to Address Adolescent Risky Behaviors: A Literature Review,"Kao, T. S.; Gibbs, M. B.; Clemen-Stone, S.; Duffy, S.",2013,Western journal of nursing research,35,5,611-637,
Promoting Children's Health with Digital Games: A Review of Reviews,"Parisod, H.; Pakarinen, A.; Kauhanen, L.; Aromaa, M.; Leppanen, V.; Liukkonen, T. N.; Smed, J.; Salantera, S.",2014,Games for Health Journal,3,3,145-+,
A systematic literature review of games-based learning empirical evidence in primary education,"Hainey, T.; Connolly, T. M.; Boyle, E. A.; Wilson, A.; Razak, A.",2016,Computers & Education,102,,202-223,
Moving beyond the stigma: Systematic review of video games and their potential to combat obesity,"Guy, S.; Ratzki-Leewing, A.; Gwadry-Sridhar, F.",2011,International Journal of Hypertension,2011 (no pagination),179124,,
Sedentary behavior in Brazilian children and adolescents: a systematic review,"Guerra, P. H.; de Farias Junior, J. C.; Florindo, A. A.",2016,Revista de saude publica,50,,9,
A Systematic Review on Effect of Electronic Media among Children and Adolescents on Substance Abuse,"Khatibu, Mahalaqua Nazli; Sinha, Anju; Gaidhane, Abhay M.; Simkhada, Padam; Behere, Prakash B.; Saxena, Deepak; Unnikrishnanu, Bhaskaran; Khatib, Afroz; Ahmed, Mahjabeen; Syed, Zahiruddin Quazi",2018,Indian Journal of Community Medicine,43,,S66-S72,10.4103/ijcm.IJCM_116_18
The utilization of current technology in raising children awareness of the needs of nutrition: A literature review,"Kartika, L.; Penna, G. D. A.; Sagitadewi, A. G.; Alandia, A.",2019,Annals of Tropical Medicine and Public Health,22,11,S343,http://dx.doi.org/10.36295/ASRO.2019.221135
A Systematic Review of Digital Interventions for Improving the Diet and Physical Activity Behaviors of Adolescents,"Rose, T.; Barker, M.; Maria Jacob, C.; Morrison, L.; Lawrence, W.; Strommer, S.; Vogel, C.; Woods-Townsend, K.; Farrell, D.; Inskip, H.; Baird, J.",2017,J Adolesc Health,61,6,669-677,10.1016/j.jadohealth.2017.05.024
Establishing Computer-Assisted Instruction to Teach Academics to Students with Autism as an Evidence-Based Practice,"Root, Jenny R.; Stevenson, Bradley S.; Davis, Luann Ley; Geddes-Hall, Jennifer; Test, David W.",2017,Journal Of Autism And Developmental Disorders,47,2,275-284,10.1007/s10803-016-2947-6
Social Media and Mobile Apps for Health Promotion in Australian Indigenous Populations: Scoping Review,"Brusse, C.; Gardner, K.; McAullay, D.; Dowden, M.",2014,Journal of Medical Internet Research,16,12,56-70,
The Effects of Digital Marketing of Unhealthy Commodities on Young People: A Systematic Review,"Buchanan, Limin; Kelly, Bridget; Yeatman, Heather; Kariippanon, Kishan",2018,Nutrients,10,2,148,http://dx.doi.org/10.3390/nu10020148
Measurement of television viewing in children and adolescents: A systematic review,"Bryant, M. J.; Lucove, J. C.; Evenson, K. R.; Marshall, S.",2007,Obesity Reviews,8,3,197-209,
The effects of sedentary behavior on memory and markers of memory function: a systematic review,"Loprinzi, Paul",2019,Physician & Sportsmedicine,47,4,387-394,10.1080/00913847.2019.1607603
"Physical activity, sedentary behaviors, physical fitness, and their relation to health outcomes in youth with type 1 and type 2 diabetes: A review of the epidemiologic literature","Liese, A. D.; Ma, X.; Maahs, D. M.; Trilk, J. L.",2013,Journal of Sport and Health Science,2,1,21-38,
Computer-based auditory training (CBAT): benefits for children with language- and reading-related learning difficulties,"Loo, Jenny Hooi Yin; Bamiou, Doris-Eva; Campbell, Nicci; Luxon, Linda M.",2010,Developmental Medicine And Child Neurology,52,8,708-717,10.1111/j.1469-8749.2010.03654.x
A Systematic Review of Interventions to Enhance Healthy Lifestyle Behaviors in Adolescents Delivered via Mobile Phone Text Messaging,"Loescher, L. J.; Rains, S. A.; Kramer, S. S.; Akers, C.; Moussa, R.",2018,Am J Health Promot,32,4,865-879,10.1177/0890117116675785
A Systematic Review of Interventions to Enhance Healthy Lifestyle Behaviors in Adolescents Delivered via Mobile Phone Text Messaging,"Loescher, L. J.; Rains, S. A.; Kramer, S. S.; Akers, C.; Moussa, R.",2016,Am J Health Promot,,,,10.1177/0890117116675785
The commercial use of digital media to market alcohol products: a narrative review,"Lobstein, Tim; Landon, Jane; Thornton, Nicole; Jernigan, David",2017,Addiction,112,,21-27,
Prevention of overweight in the school arena (Structured abstract),"Lissau, I.",2007,Acta Paediatrica,96,Supplement 454,Dec-18,
The power of the web: A systematic review of studies of the influence of the internet on self-harm and suicide in young people,"Daine, Kate; Hawton, Keith; Singaravelu, Vinod; Stewart, Anne; Simkin, Sue; Montgomery, Paul",2013,PLoS ONE,8,10,,10.1371/journal.pone.0077555
Active Video Games and Physical Activity in Overweight Children and Adolescents Systematic Review,"do Carmo, J.; Goncalves, R.; Batalau, R.; Palmeira, A. L.",2013,2013 Ieee 2nd International Conference on Serious Games and Applications for Health (Segah),,,,
Interventions for adolescent substance abuse: An overview of systematic reviews,"Das, Jai K.; Salam, Rehana A.; Arshad, Ahmed; Finkelstein, Yaron; Bhutta, Zulfiqar A.",2016,Journal of Adolescent Health,59,"4, Suppl",S61-S75,10.1016/j.jadohealth.2016.06.021
Brief report on a systematic review of youth violence prevention through media campaigns: Does the limited yield of strong evidence imply methodological challenges or absence of effect?,"Cassidy, Tali; Bowman, Brett; McGrath, Chloe; Matzopoulos, Richard",2016,Journal of Adolescence,52,,22-26,10.1016/j.adolescence.2016.07.002
A review of the risks associated with children and young people’s social media use and the implications for social work practice,"Willoughby, Mark",2018,Journal of Social Work Practice,,,,10.1080/02650533.2018.1460587
The consequences of media multitasking for youth: A review,"van der Schuur, W. A.; Baumgartner, S. E.; Sumter, S. R.; Valkenburg, P. M.",2015,Computers in Human Behavior,53,,204-215,
The Role of Exergaming in Improving Physical Activity: A Review,"Sween, J.; Wallington, S. F.; Sheppard, V.; Taylor, T.; Llanos, A. A.; Adams-Campbell, L. L.",2014,Journal of Physical Activity & Health,11,4,864-870,
Energy balance-related behaviours associated with overweight and obesity in preschool children: a systematic review of prospective studies,"te Velde, S. J.; van Nassau, F.; Uijtdewilligen, L.; van Stralen, M. M.; Cardon, G.; De Craemer, M.; Manios, Y.; Brug, J.; Chinapaw, M. J.",2012,Obes Rev,13 Suppl 1,,56-74,10.1111/j.1467-789X.2011.00960.x
"The Acceptability of E-mental Health Services for Children, Adolescents, and Young Adults: A Systematic Search and Review","Struthers, Ashley; Charette, Catherine; Bapuji, Sunita Bayyavarapu; Winters, Shannon; Ye, Xibiao; Metge, Colleen; Kreindler, Sara; Raynard, Melissa; Lemaire, Jacqueline; Synyshyn, Margaret; Sutherland, Karen",2015,Canadian Journal of Community Mental Health,34,2,Jan-21,10.7870/cjcmh-2015-006
A review of research on phone addiction amongst children and adolescents in Hong Kong,"Tak Yan, Lee; Busiol, Diego",2016,International Journal of Child & Adolescent Health,9,4,433-442,
Consequences of Play: A Systematic Review of the Effects of Online Gaming,"Sublette, V. A.; Mullan, B.",2012,International Journal of Mental Health and Addiction,10,1,Mar-23,
Prevention and treatment of pediatric obesity using mobile and wireless technologies: a systematic review,"Turner, T.; Spruijt-Metz, D.; Wen, C. K. F.; Hingle, M. D.",2015,Pediatric Obesity,10,6,403-409,10.1111/ijpo.12002
A systematic review of information and communication technology-based interventions for promoting physical activity behavior change in children and adolescents,"Lau, P. W.; Lau, E. Y.; Wong, P.; Ransdell, L.",2011,Journal of medical Internet research,13,3,e48,
Systematic review of sedentary behaviour and health indicators in the early years (aged 0-4 years),"LeBlanc, A. G.; Spence, J. C.; Carson, V.; Gorber, S. C.; Dillman, C.; Janssen, I.; Kho, M. E.; Stearns, J. A.; Timmons, B. W.; Tremblay, M. S.",2012,"Applied Physiology, Nutrition and Metabolism",37,4,753-772,
"Media and Sexualization: State of Empirical Research, 1995-2015","Ward, L. M.",2016,Journal of Sex Research,53,4-May,560-577,
Internet addiction or excessive internet use,"Weinstein, Aviv; Lejoyeux, Michel",2010,The American Journal Of Drug And Alcohol Abuse,36,5,277-283,10.3109/00952990.2010.491880
