Title,Authors,Published Year,Journal,Volume,Issue,Pages,DOI
"Online communication, social media and adolescent wellbeing: A systematic narrative review","Best, Paul; Manktelow, Roger; Taylor, Brian",2014,Children and Youth Services Review,41,,27-36,10.1016/j.childyouth.2014.03.001
Effectiveness of health-promoting media literacy education: a systematic review,"Bergsma, L. J.; Carney, M. E.",2008,Health Education Research,23,3,522-542,
"Posture, Musculoskeletal Activities, and Possible Musculoskeletal Discomfort Among Children Using Laptops or Tablet Computers for Educational Purposes: A Literature Review","Binboga, E.; Korhan, O.",2014,Journal of Science Education and Technology,23,5,605-616,
Active video games to promote physical activity in children and youth: A systematic review,"Biddiss, E.; Irwin, J.",2010,Archives of Pediatrics and Adolescent Medicine,164,7,664-672,
"Benefits of the use of ICT in school activities by students with motor, speech, visual, and hearing impairment: a literature review","Lidstrom, H.; Hemmingsson, H.",2014,Scand J Occup Ther,21,4,251-66,10.3109/11038128.2014.880940
Family-based interventions for reducing sedentary time in youth: A systematic review of randomized controlled trials,"Marsh, S.; Foley, L. S.; Wilks, D. C.; Maddison, R.",2014,Obesity Reviews,15,2,117-133,
Effectiveness and behavioral mechanisms of social media interventions for positive nutrition behaviors in adolescents: A systematic review,"Hsu, Michelle S. H.; Rouf, Anika; Allman-Farinelli, Margaret",2018,Journal of Adolescent Health,63,5,531-545,10.1016/j.jadohealth.2018.06.009
Disaster media effects: A systematic review and synthesis based on the differential susceptibility to media effects model,"Houston, J. Brian; Spialek, Matthew L.; First, Jennifer",2018,Journal of Communication,68,4,734-757,10.1093/joc/jqy023
Impact of digital technologies for communicating messages on weight loss maintenance: a systematic literature review,"Holmes, W. S.; Moorhead, S. A.; Coates, V. E.; Bond, R. R.; Zheng, H.",2019,Eur J Public Health,29,2,320-328,10.1093/eurpub/cky171
Systematic Review of Research Trends in Robotics Education for Young Children,"Jung, S. E.; Won, E. S.",2018,Sustainability,10,4,24,10.3390/su10040905
Treatment of behavioral sleep problems in children and adolescents - literature review,"Kaczor, M.; Skalski, M.",2016,Psychiatria Polska,50,3,571-584,
"Media Exposure and Tobacco, Illicit Drugs, and Alcohol Use Among Children and Adolescents: A Systematic Review","Nunez-Smith, M.; Wolf, E.; Huang, H. M.; Chen, P. G.; Lee, L.; Emanuel, E. J.; Gross, C. P.",2010,Substance Abuse,31,3,174-192,
Withdrawal symptoms in internet gaming disorder: A systematic review,"Kaptsis, D.; King, D. L.; Delfabbro, P. H.; Gradisar, M.",2016,Clinical Psychology Review,43,,58-66,
Is video-based instruction effective in the rehabilitation of children with autism spectrum disorders?,"Kagohara, D. M.",2010,Dev Neurorehabil,13,2,129-40,10.3109/17518420903329281
Using iPods® and iPads® in teaching programs for individuals with developmental disabilities: A systematic review,"Kagohara, Debora M.; van der Meer, Larah; Ramdoss, Sathiyaprakash; O'Reilly, Mark F.; Lancioni, Giulio E.; Davis, Tonya N.; Rispoli, Mandy; Lang, Russell; Marschik, Peter B.; Sutherland, Dean; Green, Vanessa A.; Sigafoos, Jeff",2013,Research in Developmental Disabilities,34,1,147-156,10.1016/j.ridd.2012.07.027
Screen Time in Under-five Children,"Kaur, N.; Gupta, M.; Malhi, P.; Grover, S.",2019,Indian pediatrics,56,9,773-788,http://dx.doi.org/10.1007/s13312-019-1638-8
A Review of Technology-Based Interventions to Teach Academic Skills to Students with Autism Spectrum Disorder,"Knight, V.; McKissick, B. R.; Saunders, A.",2013,Journal of Autism and Developmental Disorders,43,11,2628-2648,
A systematic review of school-based interventions to prevent risk factors associated with noncommunicable diseases,"Saraf, D. S.; Nongkynrih, B.; Pandav, C. S.; Gupta, S. K.; Shah, B.; Kapoor, S. K.; Krishnan, A.",2012,Asia-Pacific journal of public health / Asia-Pacific Academic Consortium for Public Health,24,5,733-752,
Effects of intensive use of computers in secondary school on gender differences in attitudes towards ICT: A systematic review,"Roser, Cussó-Calabuig; Xavier Carrera, Farran; Bosch-Capblanch, Xavier",2018,Education and Information Technologies,,,Jan-29,http://dx.doi.org/10.1007/s10639-018-9706-6
A review of correlates of physical activity of children and adolescents. / Revue des facteurs en relation avec l'activite physique chez les enfants et les adolescents,"Sallis, J. F.; Prochaska, J. J.; Taylor, W. C.",2000,Medicine & Science in Sports & Exercise,32,5,963-975,
Electronic media use and sleep in school-aged children and adolescents: A review,"Cain, N.; Gradisar, M.",2010,Sleep Medicine,11,8,735-742,
The Effects of Adolescent Health-Related Behavior on Academic Performance A Systematic Review of the Longitudinal Evidence,"Busch, V.; Loyen, A.; Lodder, M.; Schrijvers, A. J. P.; van Yperen, T. A.; de Leeuw, J. R. J.",2014,Review of Educational Research,84,2,245-274,
Interventions that stimulate healthy sleep in school-aged children: a systematic literature review,"Busch, V.; Altenburg, T. M.; Harmsen, I. A.; Chinapaw, M. J.",2017,European Journal of Public Health,27,1,53-65,
Use of active video games to increase physical activity in children: a (virtual) reality?,"Foley, L.; Maddison, R.",2010,Pediatric exercise science,22,1,Jul-20,
Smoking in video games: A systematic review,"Forsyth, S. R.; Malone, R. E.",2016,Nicotine and Tobacco Research,18,6,1390-1398,
Television viewing associated with adverse dietary outcomes in children ages 2-6,"Ford, C.; Ward, D.; White, M.",2012,Obesity Reviews,13,12,1139-1147,
Telepsychology outcome research with children and adolescents: A review of the literature,"Slone, Norah C.; Reese, Robert J.; McClellan, Michael J.",2012,Psychological Services,9,3,272-292,10.1037/a0027607
Can technology be effective in interventions targeting sexual health and substance use in young people; A systematic review,"McLellan, J.; Dale, H.",2013,Health and Technology,3,3,195-203,
A systematic review of randomised control trials of sexual health interventions delivered by mobile technologies,"Burns, K.; Keating, P.; Free, C.",2016,Bmc Public Health,16,,,
"The effects of television advertising on materialism, parent-child conflict, and unhappiness: A review of research","Buijzen, M.; Valkenburg, P. M.",2003,Journal of Applied Developmental Psychology,24,4,437-456,
Quality of life in overweight and obese children and adolescents: a literature review,"Buttitta, M.; Iliescu, C.; Rousseau, A.; Guerrien, A.",2014,"Quality of life research : an international journal of quality of life aspects of treatment, care and rehabilitation",23,4,1117-1139,
Mobile phone-based behavioural interventions for health: A systematic review,"Buhi, Eric R; Trudnak, Tara E; Martinasek, Mary P; Oberne, Alison B; Fuhrmann, Hollie J; McDermott, Robert J",2013,Health Education Journal,72,5,564-583,
Computer- and web-based interventions to increase preadolescent and adolescent physical activity: A systematic review,"Hamel, L. M.; Robbins, L. B.; Wilbur, J.",2011,Journal of Advanced Nursing,67,2,251-268,
Computer- and web-based interventions to promote healthy eating among children and adolescents: A systematic review,"Hamel, L. M.; Robbins, L. B.",2013,Journal of Advanced Nursing,69,1,16-30,
A systematic review of effective interventions for reducing multiple health risk behaviors in adolescence (Provisional abstract),"Hale, D. R.; Fitzgerald-Yau, N.; Viner, R. M.",2014,American Journal of Public Health,104,5,e19-41,
Computer assisted instruction in reading for students with learning disabilities: a research synthesis,"Hall, Tracey E.; Hughes, Charles A.; Filbert, Melinda",2000,Education & Treatment of Children (ETC),23,2,173-193,
Screen time and sleep among school-aged children and adolescents: A systematic literature review,"Hale, L.; Guan, S.",2015,Sleep Medicine Reviews,21,,50-58,
Correlates of adolescent cyberbullying in South Korea in multiple contexts: A review of the literature and implications for research and school practice,"Lee, Jeoung Min; Hong, Jun Sung; Yoon, Jina; Peguero, Anthony A.; Seok, Hee Joung",2018,Deviant Behavior,39,3,293-308,10.1080/01639625.2016.1269568
The efficacy of cognitive interventions for improving cognitive performance and academic achievement in children after cancer treatment: A systematic review,"Pfeiffer, S. M.; Hutchinson, A. D.",2018,J Psychosoc Oncol,36,2,238-258,10.1080/07347332.2017.1399954
Systematic review of cyberbullying interventions for youth and parents with implications for evidence‐based practice,"Hutson, Elizabeth; Kelly, Stephanie; Militello, Lisa K.",2018,Worldviews on Evidence-Based Nursing,15,1,72-79,10.1111/wvn.12257
Videogames for Emotion Regulation: A Systematic Review,"Villani, D.; Carissoli, C.; Triberti, S.; Marchetti, A.; Gilli, G.; Riva, G.",2018,Games for Health Journal,7,2,85-99,10.1089/g4h.2017.0108
The relationship between television exposure and children's cognition and behaviour: A systematic review,"Kostyrka-Allchorne, K.; Cooper, N. R.; Simpson, A.",2017,Developmental Review,44,,19-58,
Internet Gaming Addiction: A Systematic Review of Empirical Research,"Kuss, D. J.; Griffiths, M. D.",2012,International Journal of Mental Health and Addiction,10,2,278-296,
Mobile Phone Interventions for Adolescent Sexual and Reproductive Health: A Systematic Review,"L'Engle, Kelly L.; Mangone, Emily R.; Parcesepe, Angela M.; Agarwal, Smisha; Ippoliti, Nicole B.",2016,Pediatrics,138,3,,10.1542/peds.2016-0884
Is Sitting Time a Strong Predictor of Weight Gain?,"Kolle, E.; Ekelund, U.",2013,Current Obesity Reports,2,1,77-85,
A systematic review of strategies and computer-based intervention (CBI) for reading comprehension of children with autism,"Khowaja, K.; Salim, S. S.",2013,Research in Autism Spectrum Disorders,7,9,1111-1121,
The association of sedentary lifestyle with childhood asthma. The role of nurse as educator,"Konstantaki, E.; Priftis, K. N.; Antonogeorgos, G.; Papoutsakis, C.; Drakouli, M.; Matziou, V.",2014,Allergologia et Immunopathologia,42,6,609-615,
Correlates of sedentary behaviours in preschool children: a review,"Hinkley, T.; Salmon, J.; Okely, A. D.; Trost, S. G.",2010,International Journal of Behavioral Nutrition and Physical Activity,7,,,
The associations between sedentary behaviour and mental health among adolescents: a systematic review,"Hoare, Erin; Milton, Karen; Foster, Charlie; Allender, Steven",2016,The International Journal Of Behavioral Nutrition And Physical Activity,13,1,108-108,
Alcohol marketing and youth alcohol consumption: a systematic review of longitudinal studies published since 2008,"Jernigan, D.; Noel, J.; Landon, J.; Thornton, N.; Lobstein, T.",2017,Addiction,112,,Jul-20,
The Influence of Young Children's Use of Technology on Their Learning: A Review,"Hsin, C. T.; Li, M. C.; Tsai, C. C.",2014,Educational Technology & Society,17,4,85-99,
A review of research on bridging the gap between formal and informal learning with technology in primary school contexts,"Jagušt, T. tomislav jagust fer hr; Botički, I.; So, H. ‐J",2018,Journal of Computer Assisted Learning,34,4,417-428,10.1111/jcal.12252
Review on teaching and learning of computational thinking through programming: What is next for K-12?,"Lye, Sze Yee lye szeyee gmail com; Koh, Joyce Hwee Ling joyce koh nie edu sg",2014,Computers in Human Behavior,41,,51-61,10.1016/j.chb.2014.09.012
Intervening to reduce sedentary behaviors and childhood obesity among school-age youth: A systematic review of randomized trials,"Leung, M. M.; Agaronov, A.; Grytsenko, K.; Yeh, M. C.",2012,Journal of Obesity,2012 (no pagination),685430,,
Possible Effects of Internet Use on Cognitive Development in Adolescence,"Mills, K. L.",2016,Media and Communication,4,3,4-Dec,
Gaming- a bane or a boon-a systematic review,"John, Nisha; Sharma, Manoj Kumar; Kapanee, Aruna Rose Mary",2019,Asian journal of psychiatry,42,,Dec-17,10.1016/j.ajp.2019.03.001
The impact of game-based learning on the achievement of learning goals and motivation for learning mathematics-literature review,"Divjak, Blaženka; Tomić, Damir",2011,Journal of Information and Organizational Sciences,35,1,15-30,
Nutritional interventions for adolescents using information and communication technologies (ICTs): A systematic review,"do Amaral, E. Melo G. R.; de Carvalho Silva Vargas, F.; Dos Santos Chagas, C. M.; Toral, N.",2017,PLoS One,12,9,e0184509,10.1371/journal.pone.0184509
Sleep and weight-related factors in youth: A systematic review of recent studies,"Krietsch, Kendra N.; Chardon, Marie L.; Beebe, Dean W.; Janicke, David M.",2019,Sleep medicine reviews,46,,87-96,10.1016/j.smrv.2019.04.010
Mobile phone dermatitis in children and adults: A review of the literature,"Richardson, C.; Hamann, C. R.; Hamann, D.; Thyssen, J. P.",2014,"Pediatric, Allergy, Immunology, and Pulmonology",27,2,60-69,
Social media and suicide prevention: A systematic review,"Robinson, Jo; Cox, Georgina; Bailey, Eleanor; Hetrick, Sarah; Rodrigues, Maria; Fisher, Steve; Herrman, Helen",2016,Early Intervention in Psychiatry,10,2,103-121,10.1111/eip.12229
Internet-Delivered Health Interventions That Work: Systematic Review of Meta-Analyses and Evaluation of Website Availability,"Rogers, M. A.; Lemmen, K.; Kramer, R.; Mann, J.; Chopra, V.",2017,J Med Internet Res,19,3,e90,10.2196/jmir.7111
A systematic review of computerised serious educational games about alcohol and other drugs for adolescents,"Rodriguez, D. M.; Teesson, M.; Newton, N. C.",2014,Drug and Alcohol Review,33,2,129-135,
Mass media interventions for preventing smoking in young people,"Brinn, M. P.; Carson, K. V.; Esterman, A. J.; Chang, A. B.; Smith, B. J.",2010,Cochrane database of systematic reviews (Online),11,,CD001006,
Systematic review of school-based interventions that focus on changing dietary intake and physical activity levels to prevent childhood obesity: an update to the obesity guidance produced by the National Institute for Health and Clinical Excellence (Structured abstract),"Brown, T.; Summerbell, C.",2009,Obesity Reviews,10,1,110-141,
The influence of violent media on children and adolescents: A public-health approach,"Browne, K. D.; Hamilton-Giachritsis, C.",2005,Lancet,365,9460,702-710,
Are computers the solution to support development in children in need of special support?,"Brodin, J.; Lindstrand, P.",2004,Technology & Disability,16,3,137-145,
Promoting physical activity amongst children outside of physical education classes: A systematic review integrating intervention studies and qualitative studies,"Brunton, G.; Thomas, J.; Harden, A.; Rees, R.; Kavanagh, J.; Oliver, S.; Shepherd, J.; Oakley, A.",2005,Health Education Journal,64,4,323-338,
A systematic review of the relationship between sitting and upper quadrantmusculoskeletal pain in children and adolescents,"Brink, Y.; Louw, Q. A.",2013,Manual Therapy,18,4,281-288,
"Computer assisted instruction with deaf children: Panacea, placebo or poison?","Braden, J. P.; Shaw, S. R.",1987,American Annals of the Deaf,132,3,189-193,
Are field-based exergames useful in preventing childhood obesity? A systematic review,"Gao, Z.; Chen, S.",2014,Obesity Reviews: An Official Journal Of The International Association For The Study Of Obesity,15,8,676-691,10.1111/obr.12164
Use of Multimedia or Mobile Devices By Adolescents for Health Promotion And Disease Prevention: A Literature Review,"Geckle, Joan",2016,Pediatric Nursing,42,4,163-167,
The effectiveness of school based interventions in promoting physical activity and fitness among children and youth: A systematic review,"Dobbins, M.; DeCorby, K.; Robeson, P.; Husson, H.; Trillis, D.",2011,,24,,111-210,
The use of telehealth services to facilitate audiological management for children: A scoping review and content analysis,"Govender, S. M.; Mars, M.",2017,Journal of Telemedicine and Telecare,23,3,392-401,
Couch kids: Correlates of television viewing among youth,"Gorely, T.; Marshall, S. J.; Biddle, S. J. H.",2004,International journal of behavioral medicine,11,3,152-163,
School-based physical activity programs for promoting physical activity and fitness in children and adolescents aged 6 to 18,"Dobbins, M.; Husson, H.; DeCorby, K.; LaRocca, R. L.",2013,Cochrane database of systematic reviews (Online),2,,CD007651,
The prevention of overweight and obesity in children and adolescents: A review of interventions and programmes,"Doak, C. M.; Visscher, T. L. S.; Renders, C. M.; Seidell, J. C.",2006,Obesity Reviews,7,1,111-136,
Technology applications for students with literacy problems: a critical review,"MacArthur, Charles A.; Ferretti, Ralph P.; Okolo, Cynthia M.",2001,Elementary School Journal,101,3,273-301,10.1086/499669
The relationship between sleep and problematic smartphone use among adolescents: A systematic review,"Mac Cárthaigh, Saoirse; Griffin, Claire; Perry, John",2020,Developmental Review,55,,N.PAG-N.PAG,10.1016/j.dr.2020.100897
"The non-advertising effects of screen-based sedentary activities on acute eating behaviours in children, adolescents, and young adults. A systematic review","Marsh, S.; Ni Mhurchu, C.; Maddison, R.",2013,Appetite,71,,259-273,
New digital media interventions for sexual health promotion among young people: a systematic review,"Wadham, Erin; Green, Clare; Debattista, Joseph; Somerset, Shawn; Sav, Adem",2019,Sexual Health (Online),16,2,101-123,http://dx.doi.org/10.1071/SH18127
A review of computer and Internet-based interventions for smoking behavior,"Walters, Scott T.; Wright, Jo Anne; Shegog, Ross",2006,Addictive Behaviors,31,2,264-277,
"A Systematic Review and Evaluation of Video Modeling, Role-Play and Computer-Based Instruction as Social Skills Interventions for Children and Adolescents with High-Functioning Autism","McCoy, A.; Holloway, J.; Healy, O.; Rispoli, M.; Neely, L.",2016,Review Journal of Autism and Developmental Disorders,3,1,48-67,
The impact of digital devices vs. Pen(cil) and paper on primary school students' writing skills - A research review,"Wollscheid, S.; Sjaastad, J.; Tomte, C.",2016,Computers & Education,95,,19-35,
Interactive social media interventions to promote health equity: an overview of reviews,"Welch, V.; Petkovic, J.; Pardo Pardo, J.; Rader, T.; Tugwell, P.",2016,"Health promotion and chronic disease prevention in Canada : research, policy and practice",36,4,63-75,
The screens culture: Impact on ADHD,"Weiss, M. D.; Baer, S.; Allan, B. A.; Saran, K.; Schibuk, H.",2011,ADHD Attention Deficit and Hyperactivity Disorders,3,4,327-334,
Interventions designed to reduce sedentary behaviours in young people: a review of reviews,"Biddle, S. J.; Petrolini, I.; Pearson, N.",2014,British journal of sports medicine,48,3,182-186,
Sedentary behaviour and adiposity in youth: a systematic review of reviews and analysis of causality,"Biddle, Stuart J. H.; García Bengoechea, Enrique; Wiesner, Glen",2017,The International Journal Of Behavioral Nutrition And Physical Activity,14,1,43-43,10.1186/s12966-017-0497-8
Using Mobile Apps to Promote a Healthy Lifestyle Among Adolescents and Students: A Review of the Theoretical Basis and Lessons Learned,"Dute, D. J.; Bemelmans, W. J. E.; Breda, J.",2016,Jmir Mhealth and Uhealth,4,2,216-230,
"A systematic review of the psychometric properties, usability and clinical impacts of mobile mood-monitoring applications in young people","Dubad, M.; Winsper, C.; Meyer, C.; Livanou, M.; Marwaha, S.",2018,Psychological Medicine,48,2,208-228,10.1017/S0033291717001659
Writing Interventions for High School Students With Disabilities: A Review of Single-Case Design Studies,"Cook, K. B.; Bennett, K. E.",2014,Remedial and Special Education,35,6,344-355,
A systematic literature review of empirical evidence on computer games and serious games,"Connolly, T. M.; Boyle, E. A.; MacArthur, E.; Hainey, T.; Boyle, J. M.",2012,Computers & Education,59,2,661-686,
Sedentary behavior and health outcomes: an overview of systematic reviews,"de Rezende, Leandro Fornias Machado; Rodrigues Lopes, Maurício; Rey-López, Juan Pablo; Matsudo, Victor Keihan Rodrigues; Luiz, Olinda do Carmo",2014,Plos One,9,8,e105620-e105620,10.1371/journal.pone.0105620
"Behavioral determinants of physical activity across the life course: a ""DEterminants of DIet and Physical ACtivity"" (DEDIPAC) umbrella systematic literature review","Condello, G.; Puggina, A.; Aleksovska, K.; Buck, C.; Burns, C.; Cardon, G.; Carlin, A.; Simon, C.; Ciarapica, D.; Coppinger, T.; Cortis, C.; D'Haese, S.; De Craemer, M.; Di Blasio, A.; Hansen, S.; Iacoviello, L.; Issartel, J.; Izzicupo, P.; Jaeschke, L.; Kanning, M.; Kennedy, A.; Ling, F. C. M.; Luzak, A.; Napolitano, G.; Nazare, J. A.; Perchoux, C.; Pesce, C.; Pischon, T.; Polito, A.; Sannella, A.; Schulz, H.; Sohun, R.; Steinbrecher, A.; Schlicht, W.; Ricciardi, W.; MacDonncha, C.; Capranica, L.; Boccia, S.",2017,International Journal of Behavioral Nutrition and Physical Activity,14,,,
Just telling and selling: current limitations in the use of digital media in public health A scoping review,"Clar, C.; Dyakova, M.; Curtis, K.; Dawson, C.; Donnelly, P.; Knifton, L.; Clarke, A.",2014,Public Health,128,12,1066-1075,
Effect of television violence on aggressiveness,"Freedman, J. L.",1984,Psychological bulletin,96,2,227-246,
Enhancing Students' Scientific Literacy Using Interactive Simulations: A Critical Literature Review,"Fan, Xinxin; Geelan, David",2013,Journal of Computers in Mathematics and Science Teaching,32,2,125-171,
Can skin cancer prevention be improved through mobile technology interventions? A systematic review,"Finch, L.; Janda, M.; Loescher, L. J.; Hacker, E.",2016,Preventive Medicine,90,,121-132,
"Cyberbullying, Race/Ethnicity and Mental Health Outcomes: A Review of the Literature","Edwards, L.; Kontostathis, A. E.; Fisher, C.",2016,Media and Communication,4,3,71-78,
Is the relationship between sedentary behaviour and cardiometabolic health in adolescents independent of dietary intake? A systematic review,"Fletcher, E.; Leech, R.; McNaughton, S. A.; Dunstan, D. W.; Lacy, K. E.; Salmon, J.",2015,Obesity Reviews,16,9,795-805,
Serious games for the treatment or prevention of depression: A systematic review,"Fleming, Theresa M.; Cheek, Colleen; Merry, Sally N.; Thabrew, Hiran; Bridgman, Heather; Stasiak, Karolina; Shepherd, Matthew; Perry, Yael; Hetrick, Sarah",2014,Revista de Psicopatología y Psicología Clínica,19,3,227-242,
Is Mr Pac Man eating our children? A review of the effect of video games on children,"Emes, C. E.",1997,Canadian Journal Of Psychiatry. Revue Canadienne De Psychiatrie,42,4,409-414,
Relationship between sleep duration and childhood obesity: Systematic review including the potential underlying mechanisms,"Felső, R.; Lohner, S.; Hollódy, K.; Erhardt, É; Molnár, D.",2017,"Nutrition, Metabolism, And Cardiovascular Diseases: NMCD",27,9,751-761,10.1016/j.numecd.2017.07.008
Relationship between sleep duration and childhood obesity: Systematic review including the potential underlying mechanisms,"Felso, R.; Lohner, S.; Hollody, K.; Erhardt, E.; Molnar, D.",2017,"Acta Paediatrica, International Journal of Paediatrics",106 (Supplement 470),,15,
Cross-sectional and longitudinal epidemiological studies of Internet gaming disorder: A systematic review of the literature,"Mihara, S.; Higuchi, S.",2017,Psychiatry and Clinical Neurosciences,71,7,425-444,
The effectiveness of assistive technologies for children with special needs: a review of research-based studies,"Maor, Dorit; Currie, Jan; Drewry, Rachel",2011,European Journal of Special Needs Education,26,3,283-298,10.1080/08856257.2011.593821
A systematic review of school-based alcohol and other drug prevention programs facilitated by computers or the Internet,"Champion, K. E.; Newton, N. C.; Barrett, E. L.; Teesson, M.",2013,Drug and Alcohol Review,32,2,115-123,
"Internet gaming addiction, problematic use of the Internet, and sleep problems: A systematic review","Lam, L. T.",2014,Current Psychiatry Reports,16,4,,
Games for enhancing basic reading and maths skills: A systematic review of educational game design in supporting learning by people with learning disabilities,"Lamsa, J.; Hamalainen, R.; Aro, M.; Koskimaa, R.; Ayramo, S. M.",2018,British Journal of Educational Technology,49,4,596-607,10.1111/bjet.12639
Exergaming as a strategic tool in the fight against childhood obesity: a systematic review,"Lamboglia, Carminda Maria Goersch Fontenele; da Silva, Vanina Tereza Barbosa Lopes; de Vasconcelos Filho, José Eurico; Pinheiro, Mônica Helena Neves Pereira; Munguba, Marilene Calderaro da Silva; Silva Júnior, Francisco Valmar Isaias; de Paula, Fernando Alberto Ramirez; da Silva, Carlos Antônio Bruno",2013,Journal Of Obesity,2013,,438364-438364,10.1155/2013/438364
Use of mass media campaigns to change health behaviour,"Wakefield, M. A.; Loken, B.; Hornik, R. C.",2010,The Lancet,376,9748,1261-1271,
Personalization in Game Design for Healthcare: a Literature Review on its Definitions and Effects,"van Dooren, M. M. M.; Visch, V. T.; Spijkerman, R.; Goossens, R. H. M.; Hendriks, V. M.",2016,International Journal of Serious Games,3,4,Mar-28,
Televisions Impact on Fantasy Play - a Review of Research,"Vandervoort, T. H. A.; Valkenburg, P. M.",1994,Developmental Review,14,1,27-51,
Use of iPads and iPods for Academic Performance and Engagement of PreK-12 Students with Disabilities: A Research Synthesis,"Ok, M. W.; Kim, W.",2017,Exceptionality,25,1,54-75,
A systematic review of technology-based interventions for unintentional injury prevention education and behaviour change,"Omaki, E.; Rizzutti, N.; Shields, W.; Zhu, J.; McDonald, E.; Stevens, M. W.; Gielen, A.",2017,Injury Prevention,23,2,138-+,
